scheme_name,scheme_url
Aama Kuni Pilaa,https://www.myscheme.gov.in/schemes/akpod
Aapki Beti Yojana,https://www.myscheme.gov.in/schemes/aby
Abhayakiranam Scheme-Financial Assistance To Destitute Widows,https://www.myscheme.gov.in/schemes/as-fadw
Additional Pension to Widow of Ex-Serviceman having Children,https://www.myscheme.gov.in/schemes/apwesmc
Additional Pension to Widow of Ex-Serviceman having No Child,https://www.myscheme.gov.in/schemes/apwesmnc
Alpsankhyak Muslim Parityaqta/Talaqshuda Mahila Sahayata Yojana,https://www.myscheme.gov.in/schemes/amptmsy
Anganwadi Workers Welfare Fund,https://www.myscheme.gov.in/schemes/awwfu
Annai Teresa Ninaivu Marriage Assistance Scheme for Orphan Girls-II,https://www.myscheme.gov.in/schemes/atnmasfogii
Asangathit Karmakaar Silai Machine Sahayata Yojana,https://www.myscheme.gov.in/schemes/aksmsy
Ashirbad: Scheme for Specially Cared Children,https://www.myscheme.gov.in/schemes/speciallycaredchildren
Ashirwad,https://www.myscheme.gov.in/schemes/asd
Assistance for Daughter's Marriage,https://www.myscheme.gov.in/schemes/afdm
Assistance For Delivery / Miscarriage Of Pregnancy / Termination Of Pregnancy To Female Differently Abled Person,https://www.myscheme.gov.in/schemes/admptpfdap
Assistance for Delivery of a Child or the Miscarriage of Pregnancy or the Termination of Pregnancy,https://www.myscheme.gov.in/schemes/adcmptp
Assistance For Purchase of Aids/Appliances,https://www.myscheme.gov.in/schemes/afpoaa
Assistance Scheme for Handloom Spinning-Weaving Women Workers,https://www.myscheme.gov.in/schemes/ashswwwuk
Attendance Scholarship Scheme for Girl Students with Disabilities of Rural Areas,https://www.myscheme.gov.in/schemes/assgsdra
Award of Opportunity Cost to Parents of Scheduled Caste Girl Students,https://www.myscheme.gov.in/schemes/aocpscgs
"Awareness Programme on Child/Human Trafficking, Family Planning, Legal Awareness, Health etc.",https://www.myscheme.gov.in/schemes/apchtfplahe
Back-To-Lab Post-Doctoral Fellowship Programme,https://www.myscheme.gov.in/schemes/btlpdfp
Back-to-Lab Research Fellowship Programme,https://www.myscheme.gov.in/schemes/btlrfp
Bal Shakti Yojana,https://www.myscheme.gov.in/schemes/bsymp
Bal Swasthya Karyakram - Uttarakhand,https://www.myscheme.gov.in/schemes/chpuk
Balika Samrithi Yojana,https://www.myscheme.gov.in/schemes/bsy-pudu
BC & EBC Girls Residential +2 High School,https://www.myscheme.gov.in/schemes/bcebcgrhs
Bebe Nanki Laadli Beti Kalyan Scheme,https://www.myscheme.gov.in/schemes/bnlbks
Beti Hai Anmol Yojana,https://www.myscheme.gov.in/schemes/bhay
Bhagwan Budhdh Scholarship,https://www.myscheme.gov.in/schemes/bbs
Bhagyalaxmi Scheme,https://www.myscheme.gov.in/schemes/bys
Bharati Scheme for Education - 1st Class to 5th Class,https://www.myscheme.gov.in/schemes/bse
Bharati Scheme for Education - 6th Class to 10th Class,https://www.myscheme.gov.in/schemes/bse-6c10c
Bharati Scheme for Education - Graduation,https://www.myscheme.gov.in/schemes/bse-g
Bharati Scheme for Education - Intermediate or Equivalent,https://www.myscheme.gov.in/schemes/bse-ie
Bharati Scheme for Education - Post-Graduation,https://www.myscheme.gov.in/schemes/bse-pg
Bharati Scheme for Education - Professional Education Course,https://www.myscheme.gov.in/schemes/bse-pec
Bharati Scheme for Education Professional Education Course - Chartered Accountancy Intern,https://www.myscheme.gov.in/schemes/bsepec-cai
Bicycle Distribution Scheme for Girl Students of Economically Weaker Section,https://www.myscheme.gov.in/schemes/akvkckcvy
Biotechnology Career Advancement And Re-orientation (BioCARe) Programme For Women Scientists,https://www.myscheme.gov.in/schemes/biocare
CBSE Merit Scholarship Scheme For Single Girl Child,https://www.myscheme.gov.in/schemes/msssgc
Charmashilpa Scheme,https://www.myscheme.gov.in/schemes/cs
Chief Minister Ekal Nari Samman Pension Yojana,https://www.myscheme.gov.in/schemes/cmenspy
Chief Minister Kanya Utthan Yojana,https://www.myscheme.gov.in/schemes/cmkuy
Chief Minister Ladli Behna Yojana,https://www.myscheme.gov.in/schemes/cmlby
Chief Minister Nari Shakti Yojana,https://www.myscheme.gov.in/schemes/cmnsy
Chief Minister’s Girl Child Protection Scheme-I,https://www.myscheme.gov.in/schemes/cmgcpsi
Chief Minister’s Girl Child Protection Scheme-II,https://www.myscheme.gov.in/schemes/cmgcpsii
Child Adoption - Tamil Nadu,https://www.myscheme.gov.in/schemes/catn
Children's Drawing Painting Competition,https://www.myscheme.gov.in/schemes/cdpc
Comprehensive Educational Loan Scheme - Sikkim,https://www.myscheme.gov.in/schemes/cels-s
Concessional Bus Travel Facility to Women above 60 years of age- Punjab,https://www.myscheme.gov.in/schemes/cbtfw60ya-p
Cycle Distribution Scheme,https://www.myscheme.gov.in/schemes/cds
Cycle Sahayata Yojana,https://www.myscheme.gov.in/schemes/csy-j
Dai Didi Mobile Clinic Scheme,https://www.myscheme.gov.in/schemes/ddmcs
Deen Dayal Antyodaya Yojana - National Urban Livelihoods Mission (DAY-NULM): Self-Help Group - Uttarakhand,https://www.myscheme.gov.in/schemes/daynulmshguk
Deen Dayal Upadhyaya Bunkar Yojana,https://www.myscheme.gov.in/schemes/dduby
Delhi Pension Scheme To Women In Distress (Widow Pension),https://www.myscheme.gov.in/schemes/dpswdwp
Deserted Women Pension Scheme,https://www.myscheme.gov.in/schemes/dwp
Destitute Agricultural Labourers Pension Scheme,https://www.myscheme.gov.in/schemes/dalps
Destitute Differently Abled Pension Scheme,https://www.myscheme.gov.in/schemes/ddaps
Destitute Widow Pension Scheme,https://www.myscheme.gov.in/schemes/dwps
Destitute Widow Pension Scheme - Uttarakhand,https://www.myscheme.gov.in/schemes/uwps
Destitute/Deserted Wives Pension Scheme,https://www.myscheme.gov.in/schemes/ddwps
Devnarayan Scooty Distribution And Incentive Scheme,https://www.myscheme.gov.in/schemes/dsdais
Distribution of Female Menstrual Hygiene Kit for the Construction Workers,https://www.myscheme.gov.in/schemes/dfmkftcw
District Central Cooperative Banks and through its Branches: For Working Women,https://www.myscheme.gov.in/schemes/dccbfww
Doodh Sanjeevani Yojana,https://www.myscheme.gov.in/schemes/dsy-g
Dr. Dharmambal Ammaiyar Ninaivu Widow Remarriage Assistance Scheme-II,https://www.myscheme.gov.in/schemes/ddanwrasii
Dr. Muthulakshmi Reddy Ninaivu Inter-caste Marriage Assistance Scheme-II,https://www.myscheme.gov.in/schemes/dmrnicmasii
Dulari Kanya,https://www.myscheme.gov.in/schemes/dk
Dulari Scheme,https://www.myscheme.gov.in/schemes/ds-aandn
E.V.R. Maniammaiyar Ninaivu Marriage Assistance Scheme for Daughter’s of Poor Widows: Scheme-I,https://www.myscheme.gov.in/schemes/evrmnmasfdopwsi
E.V.R. Maniammaiyar Ninaivu Marriage Assistance Scheme for Daughter’s of Poor Widows: Scheme-II,https://www.myscheme.gov.in/schemes/evrmnmasfdopwsii
ECCE (Early Childhood Care and Education),https://www.myscheme.gov.in/schemes/ecceuk
Economic Help To Sahariya Tribal Girl Students (Class 11 And 12),https://www.myscheme.gov.in/schemes/ehstgs
Economic Help To Tribal Girls For Higher Education (Class 11 & 12),https://www.myscheme.gov.in/schemes/ehftg
Economic Help To Tribal Girls For Higher Education (College Level),https://www.myscheme.gov.in/schemes/ehttg
Education Development Scholarship for Single Girl Child,https://www.myscheme.gov.in/schemes/edssgc
Education Loan Scheme: Haryana Women Development Corporation,https://www.myscheme.gov.in/schemes/elshrwcd
Educational Allowances to the Children of Widows,https://www.myscheme.gov.in/schemes/eacw
Eja-Boi Shagun Yojana,https://www.myscheme.gov.in/schemes/ebsyuk
Entrepreneurship Development by SC & ST Women in Science Technology Engineering Mathematics,https://www.myscheme.gov.in/schemes/edsc-st-wistem
Female Child Birth Gift Scheme (HPBOCWWB),https://www.myscheme.gov.in/schemes/fcbghpbocwwb
Financial Assistance for Daughter's Marriage (UKBOCWWB),https://www.myscheme.gov.in/schemes/afdmcw
Financial Assistance for Education of Children of Registered Construction Worker,https://www.myscheme.gov.in/schemes/faecrcw
Financial Assistance for Girl Child Attend Her Age of 18,https://www.myscheme.gov.in/schemes/fagcaha18
Financial Assistance for Miscarriage for the Construction Workers,https://www.myscheme.gov.in/schemes/famcw
Financial Assistance for Normal Delivery and Surgical Delivery,https://www.myscheme.gov.in/schemes/fandsd
Financial Assistance for Self-Marriage of Registered Women Workers (HBOCWWB),https://www.myscheme.gov.in/schemes/fasmrwwhbocwwb
Financial Assistance For The Marriage Of Daughters Of Poor Widows And Orphan Girls,https://www.myscheme.gov.in/schemes/famdpwog
Financial Assistance for the Marriage of Daughters of Widows/Destitute Women belonging to the Scheduled Caste,https://www.myscheme.gov.in/schemes/marriage-of-daughter-of-sc-widow
Financial Assistance for the Purchase of Sewing Machine (CBOCWWB),https://www.myscheme.gov.in/schemes/fapsmcbocwwb
Financial Assistance for Working Women Workers or Wives of Male Workers for Maternity- Haryana Labour Welfare Board,https://www.myscheme.gov.in/schemes/fawwwwmwmhlwb
Financial Assistance in Marriage of Women Workers or Daughters of Workers- Haryana Labour Welfare Board,https://www.myscheme.gov.in/schemes/famwwdwhlwb
Financial Assistance To Dependent Children Of Widows And Destitute Women,https://www.myscheme.gov.in/schemes/fsdcwdw
Financial Assistance to Newlyweds under Kanyadan Yojana (Vijabhaj),https://www.myscheme.gov.in/schemes/fatnukyv
Financial Assistance to Non-Pensioner World War-II Veterans and Their Widows,https://www.myscheme.gov.in/schemes/fanpvwws
Financial Assistance To Poor & Needy Widow Women,https://www.myscheme.gov.in/schemes/fapnw
Financial Assistance to War Widows of Defence Forces,https://www.myscheme.gov.in/schemes/fawwdf
Financial Assistance To Women And Girl Acid Attack Victims,https://www.myscheme.gov.in/schemes/fawgav
Financial Incentives To Mothers Who Deliver A Girl Child (Mamta),https://www.myscheme.gov.in/schemes/fimdgc
Free Cycles to SC Girl Students Studying in Standard IX (Sarasvati Sadhna Yojana),https://www.myscheme.gov.in/schemes/fcscgsssixssy
Free Scooty Distribution for Girls (GEN-CATEGAORY-EWS),https://www.myscheme.gov.in/schemes/fsdfg
Free Supply of Note Books to the Children of Poor Widows,https://www.myscheme.gov.in/schemes/fsnbcpw
Free Travel in Uttarakhand Transport Corporation Buses to Widowed Daughters-in-Law of Freedom Fighters,https://www.myscheme.gov.in/schemes/ftutwd
Ganga Swarupa Punah Lagna Arthik Sahay Scheme,https://www.myscheme.gov.in/schemes/gsrfas
Gaon Ki Beti,https://www.myscheme.gov.in/schemes/gkb
Gargi Puruskar Yojana,https://www.myscheme.gov.in/schemes/gpy
Gargi Sanskrit Balika Chhaatravrtti Yojana,https://www.myscheme.gov.in/schemes/gsgssc
Gaura Shakti Yojana,https://www.myscheme.gov.in/schemes/gsy
Gharelu Hinsa Ki Pidita Ke Liye Sahayta Yojana,https://www.myscheme.gov.in/schemes/ghpklsy
"Gharelu Mahila Kamgar Cycle, Chhatari, Chappal/Joota Sahayta Yojana",https://www.myscheme.gov.in/schemes/gkccsy
Girl Education Promotion (Bicycle Scheme),https://www.myscheme.gov.in/schemes/pgcecycleuk
Girl Students Health & Hygiene Scheme,https://www.myscheme.gov.in/schemes/gshhs
"Goa (Technical/ Vocational Training To Sex Workers And Sexually Abused Women) Scheme, 2013 (PRABHAT)",https://www.myscheme.gov.in/schemes/gtvtswsawwws
Government Hostel for Working Women/ Girl Students,https://www.myscheme.gov.in/schemes/ghfwwgs
Government Service Home - Tamil Nadu,https://www.myscheme.gov.in/schemes/gshtn
Government Working Women’s Hostel,https://www.myscheme.gov.in/schemes/gwwh
Grant for the Marriage of Daughter of Destitute Widow,https://www.myscheme.gov.in/schemes/gsfmoddw
Grant of Financial Assistance for Performance of Marriage of Poor Brides Living Below Poverty Line,https://www.myscheme.gov.in/schemes/gfampmblpl
Grant of Financial Assistance to Poor Scheduled Caste Pregnant & Lactating Women,https://www.myscheme.gov.in/schemes/gfapscplw
Grant of Financial Assistance to the Poor Parents Having Only One Girl Child Who is Studying 8th to 10th Standard,https://www.myscheme.gov.in/schemes/gfapphoogcws81s
Grant of Incentive to the Family having One Girl/Two Girl Children and Parents who have undergone Family Planning,https://www.myscheme.gov.in/schemes/gifogc-fp
Grant of Marriage Allowance to the Widow's Daughter,https://www.myscheme.gov.in/schemes/gmawd
Grant Of Retention Scholarship to Scheduled Caste Girl Students,https://www.myscheme.gov.in/schemes/grsscgs
Grant-in-Aid Scheme to Provide Financial Assistance to the Mahila Mandals,https://www.myscheme.gov.in/schemes/giaspfamm
Grant-in-Aid Scheme To Provide Financial Assistance To The Mahila Mandals/ Women’s Self-help Groups (SWAWLAMBHAN),https://www.myscheme.gov.in/schemes/giaspfammwshg
Griha Aadhar Scheme,https://www.myscheme.gov.in/schemes/gas
Griha Lakshmi Scheme,https://www.myscheme.gov.in/schemes/gls
Health Benefits for Pregnant Mothers and Newborns through Supraja-AYUSH,https://www.myscheme.gov.in/schemes/shbpmna
Home for Mentally Challenged Children,https://www.myscheme.gov.in/schemes/hmcc
IMA Nongthangleima Yaipha Tengbang Scheme,https://www.myscheme.gov.in/schemes/inyts
Incentive for Purchase of Electric Scooter for the Daughter of a Registered Construction Worker (HBOCWWB),https://www.myscheme.gov.in/schemes/ipesdrcwhbocwwb
Incentive for the SC Widow Re-Marriage,https://www.myscheme.gov.in/schemes/iscwr
Incentive given to Encourage Inter caste Marriages,https://www.myscheme.gov.in/schemes/igteicm
Incentive Honorarium to Parents of Permanent Residents of Madhya Pradesh who enroll their Daughter in Defence Services,https://www.myscheme.gov.in/schemes/hipprmpdds
Incentive To Girls,https://www.myscheme.gov.in/schemes/itg
Incentive to Widow's Remarriage,https://www.myscheme.gov.in/schemes/iwr
Indira Amma Bhojanalya,https://www.myscheme.gov.in/schemes/iabuk
Indira Gandhi Matritva Poshan Yojana,https://www.myscheme.gov.in/schemes/igmpy
Indira Gandhi National Disability Pension Scheme - Tamil Nadu,https://www.myscheme.gov.in/schemes/igndpstn
Indira Gandhi National Widow Pension Scheme,https://www.myscheme.gov.in/schemes/ignwps
Indira Gandhi National Widow Pension Scheme (Jammu and Kashmir),https://www.myscheme.gov.in/schemes/ignwpsjak
Indira Gandhi National Widow Pension Scheme (Punjab),https://www.myscheme.gov.in/schemes/ignwpsp
Indira Gandhi National Widow Pension Scheme - Sikkim,https://www.myscheme.gov.in/schemes/ignwps-sikkim
Indira Gandhi National Widow Pension Scheme - Tamil Nadu,https://www.myscheme.gov.in/schemes/ignwpstn
Indira Gandhi National Widow Pension Scheme- Bihar,https://www.myscheme.gov.in/schemes/ignwpsb
Indira Gandhi Pyari Behna Sukh-Samman Nidhi Yojana,https://www.myscheme.gov.in/schemes/igpbssny
Indira Mahila Shakti Prashikshan Evam Kaushal Sanvardhan Yojna -RS-CIT,https://www.myscheme.gov.in/schemes/imspeksyrc
Indira Mahila Shakti Udyam Protsahan Yojana,https://www.myscheme.gov.in/schemes/imspesy
INDIRAMMA Widow Pension (Rural),https://www.myscheme.gov.in/schemes/iwp-andhra
INDIRAMMA Widow Pension (Urban),https://www.myscheme.gov.in/schemes/iwp-urban
Individual loaning scheme: Haryana Women Development Corporation,https://www.myscheme.gov.in/schemes/ilshrwcd
Indo-French Postdoctoral Research Programme for Women in Science,https://www.myscheme.gov.in/schemes/prowis-i
Indo-French Visiting/Mobility Programme for Women in Science,https://www.myscheme.gov.in/schemes/prowis-ii
Integrated Child Development Services- Uttarakhand,https://www.myscheme.gov.in/schemes/icdsuk
Integrated Social Security Scheme - Women In Distress,https://www.myscheme.gov.in/schemes/isss-wid
Integrated Social Security Scheme: Pension for Women in Distress,https://www.myscheme.gov.in/schemes/issspwd
Internship Programme for Women Students / Scholars / Social Activists / Teachers,https://www.myscheme.gov.in/schemes/ipmwcd
Janani Express Yojana,https://www.myscheme.gov.in/schemes/jey
Janani Sahayogi Yojana,https://www.myscheme.gov.in/schemes/jsymp
Janani Shishu Suraksha Karyakram,https://www.myscheme.gov.in/schemes/jssk
Janani Shishu Suraksha Karyakram Madhya Pradesh,https://www.myscheme.gov.in/schemes/jsskmp
Janani Suraksha Yojana (JSY),https://www.myscheme.gov.in/schemes/jsy1
Jharkhand Mukhyamantri Maiya Samman Yojana,https://www.myscheme.gov.in/schemes/jmmsy
Kali Bai Bheel Medhavi Chhatra Scooty Scheme,https://www.myscheme.gov.in/schemes/kbbmcss
Kalpana Chawla Chatravriti Yojana,https://www.myscheme.gov.in/schemes/kccy
Kalyana Lakshmi Pathakam,https://www.myscheme.gov.in/schemes/klp
Kalyani Sahayata Yojana (Madhya Pradesh Labor Welfare Board),https://www.myscheme.gov.in/schemes/ksymplwb
Kanya Saksharta Protsahan Yojana,https://www.myscheme.gov.in/schemes/kspy
Kanya Saksharta Protsahan Yojana (For Scheduled Caste Girls),https://www.myscheme.gov.in/schemes/kspyscg
Kanya Sumangala Yojana,https://www.myscheme.gov.in/schemes/ksy
Kanyadaan Scheme (CBOCWWB),https://www.myscheme.gov.in/schemes/kscbocwwb
Kanyadaan Scheme (HBOCWWB),https://www.myscheme.gov.in/schemes/kshbocwwb
Kanyashree Prakalpa,https://www.myscheme.gov.in/schemes/wbkanyashree
Kasturba Gandhi Residential Girls’ Hostel,https://www.myscheme.gov.in/schemes/kgbvrghuk
Kasturba Gandhi Special Term Deposit Receipt Scheme,https://www.myscheme.gov.in/schemes/kgsfdrs
Kayaka Spoorthi Scheme Karnataka,https://www.myscheme.gov.in/schemes/kssk
KCR Nutrition Kit,https://www.myscheme.gov.in/schemes/kcr-nutrition-kit
Khushi Scheme,https://www.myscheme.gov.in/schemes/ks
Khushiyon Ki Sawari Sewa - Uttarakhand,https://www.myscheme.gov.in/schemes/kkssuk
Kishori Balika Yojana (Madhya Pradesh),https://www.myscheme.gov.in/schemes/sfagmp
Kishori Balika Yojana- Uttarakhand,https://www.myscheme.gov.in/schemes/kbyuk
KULAVILAKKU,https://www.myscheme.gov.in/schemes/k-pudu
Kunwar Bai Nu Mameru Yojana Gujarat,https://www.myscheme.gov.in/schemes/kbnmyg
Laadli Laxmi Scheme,https://www.myscheme.gov.in/schemes/lls-g
Laado Protsahan Yojana,https://www.myscheme.gov.in/schemes/lpy
Ladies Vocational Centres,https://www.myscheme.gov.in/schemes/lvc
Ladli Beti Scheme,https://www.myscheme.gov.in/schemes/lbs
Ladli Laxmi Yojana,https://www.myscheme.gov.in/schemes/lly
Lakhpati Didi Yojana - Uttarakhand,https://www.myscheme.gov.in/schemes/ldyuk
Lakshmi Bai Samajik Suraksha Pension Yojana,https://www.myscheme.gov.in/schemes/lbsspy
Lakshmir Bhandar Scheme,https://www.myscheme.gov.in/schemes/lbs-wb
Lalima Abhiyaan,https://www.myscheme.gov.in/schemes/la
Maa-Badi / Maa-Badi Day-Care Centre Scheme,https://www.myscheme.gov.in/schemes/mbmbdccs
Madhu Babu Pension Yojana,https://www.myscheme.gov.in/schemes/mbpy
Madhya Pradesh Janani Suraksha Yojana,https://www.myscheme.gov.in/schemes/mpjsy
Maharishi Balmiki Chatravriti Yojana,https://www.myscheme.gov.in/schemes/mbcy
Mahila Adhikarita Yojana under NSKFDC- Haryana,https://www.myscheme.gov.in/schemes/maynskfdc-h
Mahila Bakri Palan,https://www.myscheme.gov.in/schemes/mbp
Mahila Dairy Vikas Pariyojana - Uttarakhand,https://www.myscheme.gov.in/schemes/mddpu
Mahila Kisan Yojana (Maharashtra),https://www.myscheme.gov.in/schemes/mkym
Mahila Nirman Shramik Vivah Yojana,https://www.myscheme.gov.in/schemes/mnsvy
Mahila Nursery Yojana,https://www.myscheme.gov.in/schemes/mny
Mahila Samiriddhi Yojana for Backward Classes- Haryana,https://www.myscheme.gov.in/schemes/msybc
Mahila Samiriddhi Yojana for Minority Community,https://www.myscheme.gov.in/schemes/msymc
Mahila Samman Savings Certificate,https://www.myscheme.gov.in/schemes/mssc
Mahila Samriddhi Yojana,https://www.myscheme.gov.in/schemes/cbssc-msy
Mahila Samriddhi Yojana (for women only) GNTDNT,https://www.myscheme.gov.in/schemes/msygntdnt
Mahila Samriddhi Yojana (GTKVN),https://www.myscheme.gov.in/schemes/msygtkdc
Mahila Samridhi Yojana (Maharashtra),https://www.myscheme.gov.in/schemes/msym
Mahila Samridhi Yojana under NSKFDC- Haryana,https://www.myscheme.gov.in/schemes/msynskfdc-h
Mahila Samruddhi Yojana (DAADC),https://www.myscheme.gov.in/schemes/msydaadc
Mahila Samruddhi Yojana (GSKVN),https://www.myscheme.gov.in/schemes/msygskvn
Mahila Samrudhhi Yojana (Gujarat Gopalak Vikas Nigam),https://www.myscheme.gov.in/schemes/msyggvn
Mahila Swavlamban Scheme,https://www.myscheme.gov.in/schemes/mssg
Mahila Swayamsiddha Yojana Rajasthan,https://www.myscheme.gov.in/schemes/msyr
Mahtari Vandan Yojana,https://www.myscheme.gov.in/schemes/mvy
Mai Bhago Vidya Scheme,https://www.myscheme.gov.in/schemes/mbvs
Maintenance Grant for Children with Disabilities from Birth,https://www.myscheme.gov.in/schemes/vbpa
Mamata Scheme,https://www.myscheme.gov.in/schemes/mamata
Mamta Taruni Abhiyan,https://www.myscheme.gov.in/schemes/mta
Mangalya Scheme For Widow Remarriage,https://www.myscheme.gov.in/schemes/mswr
Marriage Assistance (K.B.O.C.W.W.B),https://www.myscheme.gov.in/schemes/makbocwwb
Marriage Assistance (O.B.O.C.W.W.B),https://www.myscheme.gov.in/schemes/maobocwwb
Marriage Assistance - Folk Artist,https://www.myscheme.gov.in/schemes/mafa
Marriage Assistance for the Construction Workers,https://www.myscheme.gov.in/schemes/maftcwsb
Marriage Assistance To Differently Abled Women (Parinayam-II),https://www.myscheme.gov.in/schemes/madawp-ii
Marriage Gift Scheme (APBOCWWB),https://www.myscheme.gov.in/schemes/mgsapbocwwb
Marriage Gift Scheme - Telangana,https://www.myscheme.gov.in/schemes/mgs-tbocwwb
Marriage Grant for the Marriage of the Daughter of War Disabled Ex-Servicemen above 50% Disability,https://www.myscheme.gov.in/schemes/mgmdwdesmd
"Marriage Grant of Rs.51,000/- to Daughter/Sister of Personnel Killed/ Disabled in War/ Action/Terrorist Attack/Naxalite Attack/IS Duty",https://www.myscheme.gov.in/schemes/mgdspkdwatana
Marriage Grant to Orphan Daughter of Ex-Servicemen,https://www.myscheme.gov.in/schemes/mgodesm
Marriage Grant to War Widows’ Daughters of Ex-Servicemen,https://www.myscheme.gov.in/schemes/mgwwdesm
Mata Shabri Mahila Sashktikaran Yojana,https://www.myscheme.gov.in/schemes/msmsy
Maternity Assistance for the Construction Worker,https://www.myscheme.gov.in/schemes/mafcws
Maternity Assistance for the Construction Workers,https://www.myscheme.gov.in/schemes/mafcw
Maternity Assistance Scheme (GBOCWWB),https://www.myscheme.gov.in/schemes/masgbocwwb
Maternity Assistance Scheme (PBAOCWWB),https://www.myscheme.gov.in/schemes/mat-pbaocwwb
Maternity Assistance Scheme- Gujarat Labour Welfare Board,https://www.myscheme.gov.in/schemes/masglwb
Maternity Benefit,https://www.myscheme.gov.in/schemes/mbwb
Maternity Benefit (A.B.O.C.W.W.B),https://www.myscheme.gov.in/schemes/mbabocwwb
Maternity Benefit (ANBOCWWB),https://www.myscheme.gov.in/schemes/mbanbocwwb
Maternity Benefit (CBOCWWB),https://www.myscheme.gov.in/schemes/mbcbocwwb
Maternity Benefit (HPBOCWWB),https://www.myscheme.gov.in/schemes/mbhpbocwwb
Maternity Benefit (MBOCWWB),https://www.myscheme.gov.in/schemes/mbmbocwwb
Maternity Benefit (O.B.O.C.W.W.B),https://www.myscheme.gov.in/schemes/mbobocwwb
Maternity Benefit For Female Workers- JKBOCWWB,https://www.myscheme.gov.in/schemes/mbffwjkbocwwb
Maternity Benefit for Women Beneficiaries,https://www.myscheme.gov.in/schemes/mbfwb
Maternity Benefit Scheme (APB&OCWWB),https://www.myscheme.gov.in/schemes/mbsapbandocwwb
Maternity Benefit Scheme (HBOCWWB),https://www.myscheme.gov.in/schemes/mbs-hbocwwb
Maternity Benefit Scheme - Telangana,https://www.myscheme.gov.in/schemes/mbs-t
Maternity Benefit to the Female Beneficiary,https://www.myscheme.gov.in/schemes/mbttfb
Maternity Benefit/Delivery Assistance (K.B.O.C.W.W.B),https://www.myscheme.gov.in/schemes/mbdakbocwwb
Maternity Benefits Scheme (BBOCWWB),https://www.myscheme.gov.in/schemes/mbsbbocwwb
Maternity Financial Assistance (UKBOCWWB),https://www.myscheme.gov.in/schemes/mbsukbocwwb
Maternity Support Scheme (MPBOCWWB),https://www.myscheme.gov.in/schemes/mssmpbocwwb
"Matritva, Shishu Evam Baalika Madad Yojana",https://www.myscheme.gov.in/schemes/mesy
Matru Jyothi - Financial Assistance For PwD Mothers,https://www.myscheme.gov.in/schemes/mj-fapm
Mentally Retarded Children Benefit Scheme (HPBOCWWB),https://www.myscheme.gov.in/schemes/mrcbshpbocwwb
Micro Finance Scheme for Self Help Groups (GTKVN),https://www.myscheme.gov.in/schemes/mfsfshg
Minimata Mahtari Jatan Yojana,https://www.myscheme.gov.in/schemes/bpsy
Miscarriage Benefit,https://www.myscheme.gov.in/schemes/mbbwwb
Mission Vatsalya (Child Protection Services and Child Welfare Services),https://www.myscheme.gov.in/schemes/mvcppsacws
Moovalur Ramamirtham Ammaiyar Higher Education Assurance Scheme,https://www.myscheme.gov.in/schemes/pudhumai-penn-scheme
Moovalur Ramamirtham Ammaiyar Ninaivu Marriage Assistance Scheme - II,https://www.myscheme.gov.in/schemes/mranmas-ii
Moovalur Ramamirtham Ammaiyar Ninaivu Marriage Assistance Scheme-1,https://www.myscheme.gov.in/schemes/mranmas1
Mother Teresa Asahay Matri Sambal Yojana,https://www.myscheme.gov.in/schemes/mtamsy
Motor Vehicle Driver-Conductor Welfare Scheme- Maternity Assistance,https://www.myscheme.gov.in/schemes/mvdcws-m
Mukhya Mantri Grihini Suvidha Yojana,https://www.myscheme.gov.in/schemes/mmgsy
Mukhya Mantri Kanyadaan Yojana,https://www.myscheme.gov.in/schemes/mmky
Mukhya Mantri Mahila Nirman Shramik Sammaan Yojana (HBOCWWB),https://www.myscheme.gov.in/schemes/mmmnssyhbocwwb
Mukhya Mantri Mahila Sashaktikaran Yojana,https://www.myscheme.gov.in/schemes/mmmsy
Mukhya Mantri Matritva Sahayata Yojana,https://www.myscheme.gov.in/schemes/mmmsyh
Mukhya Mantri Shramik Seva Prasuti Sahayata Yojana,https://www.myscheme.gov.in/schemes/mmsspsy
Mukhya Mantri Vivah Shagun Yojna,https://www.myscheme.gov.in/schemes/mmvsy
Mukhyamantri - Majhi Ladki Bahin Yojana,https://www.myscheme.gov.in/schemes/mmlby
Mukhyamantri Aadim Jan Jati Pension Yojana,https://www.myscheme.gov.in/schemes/majjpy
